WGEA Quartile,TCA Member Remuneration - Average,Gender - Average,TCA Members - % Women - Average,TCA Members - % Men - Average,TCA Members - Example Roles,Direct Tech Remuneration - Average,Direct Tech Gender - Average,Direct Tech - % Women - Average,Direct Tech - % Men - Average,Australian Average Remuneration - Average,Australian Average Gender - Average,Australian Average - % Women - Average,Australian Average - % Men - Average
Q1 (Lower quartile),"$119,129","50.9% women, 49.1% men",50.9,49.1,"Quartile 1 band include, on average, a median entry-level hardware engineer, a median entry-level data scientist, a median entry-level product designer, or a median entry-level product manager.","$106,473","42.9% women, 57.1% men",42.9,57.1,"$78,684","54.1% women, 45.9% men",54.1,45.9
Q2 (Lower-middle quartile),"$168,968","45.6% women, 54.4% men",45.6,54.4,"Low-mid quartile roles include, on average, an 75th percentile entry-level product manager, a 75th percentile entry-level software engineer, a 25th percentile senior technical program manager, or a 25th percentile senior data science manager.","$150,699","35.6% women, 64.4% men",35.6,64.4,"$101,484","49.7% women, 50.3% men",49.7,50.3
Q3 (Upper-middle quartile),"$217,323","35.6% women, 64.4% men",35.6,64.4,"Mid-upper quartile roles include, on average, a median senior software engineer, a median senior ux researcher, a 75th percentile senior product designer, or a median senior security analyst.","$192,212","28.2% women, 71.8% men",28.2,71.8,"$125,966","45.3% women, 54.7% men",45.3,54.7
Q4 (Upper quartile),"$378,548","31.5% women, 68.5% men",31.5,68.5,"This top-paying quartile would contain high-level leadership roles including C-Suite and Vice President-level executives as well as top-tier technical roles like a 75th percentile senior data science manager, a 75th percentile senior security analyst.","$309,832","22.6% women, 77.4% men",22.6,77.4,"$198,785","39.4% women, 60.6% men",39.4,60.6
Total workforce,"$220,774","40.9% women, 59.1% men",40.9,59.1,,"$189,373","32.3% women, 67.7% men",32.3,67.7,"$125,999","47.1% women, 52.9% men",47.1,52.9
